{
  "op3d_schema": "filament",
  "op3d_schema_version": "0.1.0",
  "id": "Vertex/PLA",

  "maintainer": {
    "name": "OpenPrint3D",
    "maintainer_type": "community",
    "website": "https://github.com/OpenPrint3D/OpenPrint3D"
  },

  "brand": "Vertex",
  "name": "Vertex PLA 1.75mm",
  "material": "PLA",

  "color": "arctic white",
  "diameter": 1.75,
  "density": 1.24,

  "nozzle": {
    "min": 195,
    "max": 220,
    "recommended": 205
  },

  "bed": {
    "min": 45,
    "max": 60,
    "recommended": 55
  },

  "fan": {
    "min": 60,
    "max": 100,
    "recommended": 100
  },

  "drying": {
    "temperature": 45,
    "duration_hours": 4
  },

  "environment": {
    "sensitive_to_moisture": true,
    "enclosure_recommended": false,
    "max_ambient_temp": 28
  },

  "external_ids": {},
  "links": {},
  "tags": ["pla", "vertex", "1.75mm", "dutch"],

  "notes": "Vertex PLA from Netherlands. Good quality, vibrant colors. Easy to print.",

  "x_cura": {},
  "x_prusaslicer": {},
  "x_orca": {},
  "x_bambu": {}
}
