{
  "op3d_schema": "filament",
  "op3d_schema_version": "0.1.0",
  "id": "Sabic/PEKK",
  "maintainer": {
    "name": "OpenPrint3D Community",
    "maintainer_type": "community",
    "website": "https://github.com/OpenPrint3D/OpenPrint3D"
  },
  "brand": "Sabic",
  "name": "Sabic PEKK 1.75mm",
  "material": "PEKK",
  "diameter": 1.75,
  "density": 1.27,
  "nozzle": { "min": 345, "max": 405, "recommended": 375 },
  "bed": { "min": 100, "max": 135, "recommended": 115 },
  "fan": { "min": 0, "max": 30, "recommended": 15 },
  "drying": { "temperature": 100, "duration_hours": 4 },
  "environment": {
    "sensitive_to_moisture": true,
    "enclosure_recommended": true,
    "heated_chamber_recommended": true,
    "max_ambient_temp": 50
  },
  "volumetric_speed": 10,
  "printing_speed": { "min": 20, "max": 70, "recommended": 45 },
  "links": {
    "datasheet": "https://www.sabic.com/en/products-specialties"
  },
  "tags": ["pekk", "high-performance", "engineering", "1.75mm", "sabic"],
  "notes": "Sabic PEKK offers superior thermal stability and mechanical performance with excellent chemical resistance for aerospace and industrial applications."
}
