{
  "op3d_schema": "filament",
  "op3d_schema_version": "0.1.0",
  "id": "Vertex/PETG",

  "maintainer": {
    "name": "OpenPrint3D",
    "maintainer_type": "community",
    "website": "https://github.com/OpenPrint3D/OpenPrint3D"
  },

  "brand": "Vertex",
  "name": "Vertex PETG 1.75mm",
  "material": "PETG",

  "color": "ultramarine blue",
  "diameter": 1.75,
  "density": 1.27,

  "nozzle": {
    "min": 225,
    "max": 255,
    "recommended": 240
  },

  "bed": {
    "min": 65,
    "max": 80,
    "recommended": 75
  },

  "fan": {
    "min": 30,
    "max": 60,
    "recommended": 45
  },

  "drying": {
    "temperature": 55,
    "duration_hours": 4
  },

  "environment": {
    "sensitive_to_moisture": true,
    "enclosure_recommended": false,
    "max_ambient_temp": 32
  },

  "external_ids": {},
  "links": {},
  "tags": ["petg", "vertex", "1.75mm", "dutch"],

  "notes": "Vertex PETG. Good durability and impact resistance. Slight tendency to string.",

  "x_cura": {},
  "x_prusaslicer": {},
  "x_orca": {},
  "x_bambu": {}
}
