{
  "op3d_schema": "filament",
  "op3d_schema_version": "0.1.0",
  "id": "PlastyMuelle/TPU",
  "maintainer": {
    "name": "OpenPrint3D Community",
    "maintainer_type": "community",
    "website": "https://github.com/OpenPrint3D/OpenPrint3D"
  },
  "brand": "PlastyMuelle",
  "name": "TPU 1.75mm",
  "material": "TPU",
  "diameter": 1.75,
  "density": 1.21,
  "nozzle": { "min": 190, "max": 230, "recommended": 210 },
  "bed": { "min": 20, "max": 60, "recommended": 40 },
  "fan": { "min": 70, "max": 100, "recommended": 90 },
  "drying": { "temperature": 50, "duration_hours": 4 },
  "environment": {
    "sensitive_to_moisture": true,
    "enclosure_recommended": false,
    "max_ambient_temp": 30
  },
  "volumetric_speed": 6,
  "links": {
    "product_page": "https://www.plastymuelle.com/"
  },
  "tags": ["tpu", "plastymuelle", "1.75mm", "flexible", "spain", "spanish"],
  "notes": "PlastyMuelle TPU. Spanish flexible filament with good abrasion resistance."
}
