{
  "op3d_schema": "filament",
  "op3d_schema_version": "0.1.0",
  "id": "Sunlu/PLA",
  "maintainer": {
    "name": "OpenPrint3D Community",
    "maintainer_type": "community",
    "website": "https://github.com/OpenPrint3D/OpenPrint3D"
  },
  "brand": "Sunlu",
  "name": "Sunlu PLA",
  "material": "PLA",
  "diameter": 1.75,
  "density": 1.24,
  "nozzle": { "min": 190, "max": 230, "recommended": 205 },
  "bed": { "min": 40, "max": 60, "recommended": 50 },
  "fan": { "min": 50, "max": 100, "recommended": 100 },
  "drying": { "temperature": 45, "duration_hours": 4 },
  "environment": {
    "sensitive_to_moisture": true,
    "enclosure_recommended": false,
    "max_ambient_temp": 30
  },
  "volumetric_speed": 12,
  "printing_speed": { "min": 40, "max": 100, "recommended": 60 },
  "links": {
    "product_page": "https://sunlu3d.com/collections/filament"
  },
  "tags": ["pla", "sunlu", "1.75mm", "budget", "beginner-friendly"],
  "notes": "Sunlu PLA. Budget-friendly PLA with good quality and variety of colors.",
  "x_cura": {
    "material": "pla",
    "print_temperature": 205,
    "print_temperature_layer_0": 200,
    "bed_temperature": 50,
    "bed_temperature_layer_0": 50,
    "fan_speed": 100,
    "fan_speed_layer_0": 0,
    "cooling": "enabled"
  },
  "x_prusaslicer": {
    "filament_type": "PLA",
    "temperature": 205,
    "bed_temperature": 50,
    "fan_speed": 100,
    "first_layer_bed_temperature": 50,
    "first_layer_temperature": 200
  },
  "x_orca": {
    "filament_type": "PLA",
    "nozzle_temperature": 205,
    "nozzle_temperature_initial_layer": 200,
    "bed_temperature": 50,
    "bed_temperature_initial_layer": 50,
    "fan_speed": 100,
    "fan_speed_initial_layer": 0
  },
  "x_bambu": {
    "filament_type_id": "GPLA00",
    "drying_temperature": 55,
    "drying_time": 4,
    "nozzle_temperature": [190, 230],
    "nozzle_temperature_initial_layer": [190, 230],
    "bed_temperature": [35, 65],
    "bed_temperature_initial_layer": [35, 65],
    "fan_speed": [50, 100]
  }
}
