{
  "op3d_schema": "filament",
  "op3d_schema_version": "0.1.0",
  "id": "Verbatim/PLA-Plus",
  "maintainer": {
    "name": "OpenPrint3D Community",
    "maintainer_type": "community",
    "website": "https://github.com/OpenPrint3D/OpenPrint3D"
  },
  "brand": "Verbatim",
  "name": "Verbatim PLA+ 1.75mm",
  "material": "PLA",
  "variant": "Plus",
  "diameter": 1.75,
  "density": 1.24,
  "nozzle": { "min": 205, "max": 225, "recommended": 215 },
  "bed": { "min": 45, "max": 60, "recommended": 55 },
  "fan": { "min": 50, "max": 100, "recommended": 100 },
  "drying": { "temperature": 45, "duration_hours": 4 },
  "environment": {
    "sensitive_to_moisture": true,
    "enclosure_recommended": false,
    "max_ambient_temp": 30
  },
  "volumetric_speed": 12,
  "printing_speed": { "min": 40, "max": 80, "recommended": 60 },
  "links": {
    "product_page": "https://www.verbatim.com/prod/3d-printing/"
  },
  "tags": ["pla+", "pla-plus", "verbatim", "1.75mm", "tougher-than-pla", "premium"],
  "notes": "Verbatim PLA+. Premium modified PLA with improved toughness and impact resistance compared to standard PLA. Consistent diameter and high quality.",
  "x_cura": {
    "material": "pla",
    "print_temperature": 215,
    "print_temperature_layer_0": 215,
    "bed_temperature": 55,
    "bed_temperature_layer_0": 55,
    "fan_speed": 100,
    "fan_speed_layer_0": 100,
    "cooling": "maximum"
  },
  "x_prusaslicer": {
    "filament_type": "PLA",
    "temperature": 215,
    "bed_temperature": 55,
    "fan_speed": 100,
    "first_layer_bed_temperature": 55,
    "first_layer_temperature": 215
  },
  "x_orca": {
    "filament_type": "PLA",
    "nozzle_temperature": 215,
    "nozzle_temperature_initial_layer": 215,
    "bed_temperature": 55,
    "bed_temperature_initial_layer": 55,
    "fan_speed": 100,
    "fan_speed_initial_layer": 100
  },
  "x_bambu": {
    "filament_type_id": "GPLA",
    "drying_temperature": 45,
    "drying_time": 4,
    "nozzle_temperature": [205, 225],
    "nozzle_temperature_initial_layer": [205, 225],
    "bed_temperature": [45, 60],
    "bed_temperature_initial_layer": [45, 60],
    "fan_speed": [50, 100]
  }
}
