{
  "op3d_schema": "filament",
  "op3d_schema_version": "0.1.0",
  "id": "eSUN/PETG-Orange",
  "maintainer": {
    "name": "OpenPrint3D Community",
    "maintainer_type": "community",
    "website": "https://github.com/OpenPrint3D/OpenPrint3D"
  },
  "brand": "eSUN",
  "name": "eSUN PETG Orange 1.75mm",
  "material": "PETG",
  "color": "orange",
  "diameter": 1.75,
  "density": 1.27,
  "nozzle": { "min": 230, "max": 250, "recommended": 240 },
  "bed": { "min": 75, "max": 85, "recommended": 80 },
  "fan": { "min": 30, "max": 60, "recommended": 50 },
  "drying": { "temperature": 65, "duration_hours": 4 },
  "environment": {
    "sensitive_to_moisture": true,
    "enclosure_recommended": false,
    "max_ambient_temp": 35
  },
  "volumetric_speed": 12,
  "links": {
    "product_page": "https://www.esun3d.com/petg-product/"
  },
  "tags": ["petg", "esun", "1.75mm", "orange"],
  "notes": "eSUN PETG in Orange. Reliable PETG with good clarity."
}
