{
  "op3d_schema": "filament",
  "op3d_schema_version": "0.1.0",
  "id": "NinjaTek/TPU",

  "maintainer": {
    "name": "OpenPrint3D",
    "maintainer_type": "community",
    "website": "https://github.com/OpenPrint3D/OpenPrint3D"
  },

  "brand": "NinjaTek",
  "name": "NinjaTek TPU 1.75mm",
  "material": "TPU",

  "color": "black",
  "color_variants": [
    { "name": "Black", "hex": "1A1A1A" },
    { "name": "White", "hex": "F5F5F5" },
    { "name": "Red", "hex": "E63946" },
    { "name": "Blue", "hex": "457B9D" },
    { "name": "Grey", "hex": "6B7280" },
    { "name": "Natural", "hex": "E5E7EB" }
  ],
  "diameter": 1.75,
  "density": 1.21,

  "nozzle": {
    "min": 200,
    "max": 240,
    "recommended": 220
  },

  "bed": {
    "min": 30,
    "max": 50,
    "recommended": 40
  },

  "fan": {
    "min": 40,
    "max": 100,
    "recommended": 60
  },

  "drying": {
    "temperature": 50,
    "duration_hours": 6
  },

  "environment": {
    "sensitive_to_moisture": true,
    "enclosure_recommended": false,
    "max_ambient_temp": 30
  },

  "printing_speed": {
    "min": 15,
    "max": 45,
    "recommended": 30
  },

  "external_ids": {},
  "links": {
    "product_page": "https://ninjatek.com/product/ninjaflex-3d-printer-filament/"
  },
  "tags": ["tpu", "ninjatek", "1.75mm", "flexible", "ninjaflex"],

  "release": {
    "version": "1.0.0",
    "date": "2026-02-17T00:00:00Z",
    "notes": "NinjaTek TPU (NinjaFlex) profile - premium flexible filament"
  },

  "notes": "NinjaFlex is a premium TPU known for excellent flexibility and durability. Great layer bonding and abrasion resistance. Direct drive extruder recommended.",

  "x_cura": {},
  "x_prusaslicer": {},
  "x_orca": {},
  "x_bambu": {}
}
