{
  "op3d_schema": "filament",
  "op3d_schema_version": "0.1.0",
  "id": "DasFilament/PETG",
  "maintainer": {
    "name": "OpenPrint3D Community",
    "maintainer_type": "community",
    "website": "https://github.com/OpenPrint3D/OpenPrint3D"
  },
  "brand": "DasFilament",
  "name": "PETG 1.75mm",
  "material": "PETG",
  "diameter": 1.75,
  "density": 1.27,
  "nozzle": { "min": 220, "max": 260, "recommended": 240 },
  "bed": { "min": 60, "max": 90, "recommended": 75 },
  "fan": { "min": 30, "max": 80, "recommended": 60 },
  "drying": { "temperature": 55, "duration_hours": 4 },
  "environment": {
    "sensitive_to_moisture": true,
    "enclosure_recommended": false,
    "max_ambient_temp": 35
  },
  "volumetric_speed": 10,
  "links": {
    "product_page": "https://dasfilament.pl/"
  },
  "tags": ["petg", "dasfilament", "1.75mm", "poland", "polish"],
  "notes": "DasFilament PETG. Polish brand with excellent layer bonding and clarity."
}
