{
  "op3d_schema": "filament",
  "op3d_schema_version": "0.1.0",
  "id": "Extrudr/PETG",
  "maintainer": {
    "name": "OpenPrint3D Community",
    "maintainer_type": "community",
    "website": "https://github.com/OpenPrint3D/OpenPrint3D"
  },
  "brand": "Extrudr",
  "name": "PETG 1.75mm",
  "material": "PETG",
  "diameter": 1.75,
  "density": 1.27,
  "nozzle": { "min": 220, "max": 260, "recommended": 240 },
  "bed": { "min": 60, "max": 90, "recommended": 75 },
  "fan": { "min": 30, "max": 80, "recommended": 60 },
  "drying": { "temperature": 55, "duration_hours": 4 },
  "environment": {
    "sensitive_to_moisture": true,
    "enclosure_recommended": false,
    "max_ambient_temp": 35
  },
  "volumetric_speed": 10,
  "links": {
    "product_page": "https://www.extrudr.com/en/"
  },
  "tags": ["petg", "extrudr", "1.75mm", "austria"],
  "notes": "Extrudr PETG. Austrian-made PETG with excellent impact resistance and good layer adhesion."
}
