{
  "op3d_schema": "filament",
  "op3d_schema_version": "0.1.0",
  "id": "AmazonBasics/PLA-Blue",
  "maintainer": {
    "name": "OpenPrint3D Community",
    "maintainer_type": "community",
    "website": "https://github.com/OpenPrint3D/OpenPrint3D"
  },
  "brand": "Amazon Basics",
  "name": "Amazon Basics PLA Blue",
  "material": "PLA",
  "color": "blue",
  "diameter": 1.75,
  "density": 1.24,
  "nozzle": { "min": 190, "max": 230, "recommended": 205 },
  "bed": { "min": 40, "max": 60, "recommended": 50 },
  "fan": { "min": 50, "max": 100, "recommended": 100 },
  "drying": { "temperature": 45, "duration_hours": 4 },
  "environment": {
    "sensitive_to_moisture": true,
    "enclosure_recommended": false,
    "max_ambient_temp": 30
  },
  "volumetric_speed": 12,
  "printing_speed": { "min": 40, "max": 100, "recommended": 60 },
  "links": {
    "product_page": "https://www.amazon.com/basics-3d-printer-filament"
  },
  "tags": ["pla", "amazon-basics", "1.75mm", "blue", "budget", "beginner-friendly"],
  "notes": "Amazon Basics PLA in Blue. Budget-friendly PLA from Amazon's private brand."
}
